{
  "impl_id": "5d771ab8-6a00-4170-a303-6392ff85c629",
  "concept_id": "variable_declaration",
  "language_id": "typescript",
  "syntax_template": "const name: string = 'Alice' or let count: number = 0",
  "design_rationale": "const/let from ES6 for mutability. Type annotations optional due to inference. Structural typing for flexibility.",
  "sources": [
    {}
  ]
}