{
  "impl_id": "5a693a26-20c2-4435-8fcb-46cc1a5943a3",
  "concept_id": "concurrency",
  "language_id": "typescript",
  "syntax_template": "async function fetch(): Promise<Data> { return await api.get(); }",
  "design_rationale": "async/await syntax sugar over Promises. Single-threaded event loop model inherited from JavaScript.",
  "sources": [
    {
      "title": "TypeScript 1.7 Release Notes",
      "url": "https://www.typescriptlang.org/docs/handbook/release-notes/typescript-1-7.html",
      "type": "official_doc",
      "language": "typescript"
    },
    {
      "title": "TypeScript 4.5 - Awaited Type",
      "url": "https://www.typescriptlang.org/docs/handbook/release-notes/typescript-4-5.html",
      "type": "official_doc",
      "language": "typescript"
    }
  ]
}