{
  "impl_id": "18fc673b-fb24-424a-b9d8-720df23ae4fc",
  "concept_id": "concurrency",
  "language_id": "go",
  "syntax_template": "go func() { ch <- result }()",
  "design_rationale": "CSP model: goroutines + channels. 'Do not communicate by sharing memory; share memory by communicating.'",
  "sources": [
    {},
    {}
  ]
}