{
  "impl_id": "ac12dbe8-0956-4213-8643-cd6c67059f96",
  "concept_id": "error_handling",
  "language_id": "python",
  "syntax_template": "try: result = func() except ValueError as e: handle(e)",
  "design_rationale": "EAFP (Easier to Ask Forgiveness than Permission). Exceptions separate happy path from error handling.",
  "sources": [
    {}
  ]
}