{
  "impl_id": "e02a4a9d-c3a0-4d6b-a2b6-63f0ead710d5",
  "concept_id": "variable_declaration",
  "language_id": "swift",
  "syntax_template": "let name = \"Alice\" (immutable) or var count = 0 (mutable)",
  "design_rationale": "Explicit let/var distinction makes mutability a conscious choice. Compiler warns if var never mutated.",
  "sources": [
    {
      "title": "The Swift Programming Language - Constants and Variables",
      "url": "https://docs.swift.org/swift-book/LanguageGuide/TheBasics.html",
      "type": "official_doc",
      "language": "swift"
    }
  ]
}