{
  "impl_id": "0054f3ef-6ef5-4583-9808-77bd7032246b",
  "concept_id": "variable_declaration",
  "language_id": "swift",
  "syntax_template": "let name = \"Alice\" (immutable) or var count = 0 (mutable)",
  "design_rationale": "Explicit let/var distinction makes mutability a conscious choice. Compiler warns if var never mutated.",
  "sources": [
    {}
  ]
}